{
  "elementid": "RELA9",
  "relationtype": "M:N",
  "fwd": {
    "entityid": "ENTI7",
    "cardinality": "M",
    "assoctext": "goes to",
    "mandatory": true,
    "historicised": false
  },
  "bwd": {
    "entityid": "ENTI8",
    "assoctext": {
      "de": "kommt von",
      "en": "comes from"
    },
    "cardinality": "M",
    "arcnumber": 1,
    "mandatory": true,
    "historicised": true
  },
  "examples": [
    "von 1 zu viele / von viele zu 1"
  ],
  "additionalProps": [
    {
      "fkattribute": "CUST-ID"
    }
  ]
}